{
  "context": "Intelligence enablement for Cyber Threat Intelligence Platform (CTIP) to augment threat intelligence processing using local LLM for extracting relevant information from unstructured data collected by Cyber Intelligence Centre, serving as single source of threat intelligence for the Bank with compliance requirements for India and Singapore.",
  "userStories": [
    {
      "id": "US-1",
      "title": "AI-Augmented Threat Intelligence Processing",
      "asA": "Cyber Intelligence Analyst",
      "iWantTo": "process unstructured threat intelligence data using local LLM augmentation",
      "soThat": "I can extract relevant threat information at higher scale and consistency than manual processing",
      "storyPoints": 8,
      "priority": "Critical",
      "tags": ["Backend", "AI", "LLM", "ThreatIntelligence"],
      "relatedUserStories": ["US-2", "US-3"],
      "epic": "AI-Enhanced Processing Engine",
      "acceptanceCriteria": [
        {
          "id": "AC-1",
          "given": "unstructured threat intelligence data is available in CTIP",
          "when": "the LLM processing engine is triggered",
          "then": "relevant threat information is extracted and structured with 95% accuracy"
        },
        {
          "id": "AC-2",
          "given": "multiple data sources are feeding threat intelligence",
          "when": "batch processing is initiated",
          "then": "all sources are processed within defined SLA timeframes"
        },
        {
          "id": "AC-3",
          "given": "processed threat intelligence is available",
          "when": "analyst requests structured output",
          "then": "data is presented in standardized threat intelligence format"
        }
      ]
    },
    {
      "id": "US-2",
      "title": "Local LLM Integration and Management",
      "asA": "System Administrator",
      "iWantTo": "deploy and manage local LLM instances for threat intelligence processing",
      "soThat": "sensitive threat data remains within bank infrastructure while leveraging AI capabilities",
      "storyPoints": 13,
      "priority": "Critical",
      "tags": ["Infrastructure", "LLM", "Security", "LocalDeployment"],
      "relatedUserStories": ["US-1", "US-4"],
      "epic": "AI-Enhanced Processing Engine",
      "acceptanceCriteria": [
        {
          "id": "AC-4",
          "given": "local LLM infrastructure is deployed",
          "when": "threat intelligence processing is initiated",
          "then": "all data processing occurs within bank's secure environment"
        },
        {
          "id": "AC-5",
          "given": "LLM models require updates",
          "when": "administrator initiates model update",
          "then": "models are updated without compromising ongoing operations"
        },
        {
          "id": "AC-6",
          "given": "processing load varies throughout the day",
          "when": "system monitors resource utilization",
          "then": "LLM instances scale automatically to meet demand"
        }
      ]
    },
    {
      "id": "US-3",
      "title": "Unstructured Data Extraction and Classification",
      "asA": "Cyber Intelligence Analyst",
      "iWantTo": "automatically extract and classify threat indicators from unstructured documents, reports, and feeds",
      "soThat": "I can identify relevant threats more efficiently and reduce manual analysis time",
      "storyPoints": 8,
      "priority": "High",
      "tags": ["DataExtraction", "Classification", "ThreatIndicators", "Automation"],
      "relatedUserStories": ["US-1", "US-5"],
      "epic": "AI-Enhanced Processing Engine",
      "acceptanceCriteria": [
        {
          "id": "AC-7",
          "given": "unstructured threat documents are uploaded to CTIP",
          "when": "extraction engine processes the documents",
          "then": "IOCs, TTPs, and threat indicators are automatically identified and classified"
        },
        {
          "id": "AC-8",
          "given": "threat feeds contain mixed structured and unstructured data",
          "when": "classification algorithm runs",
          "then": "content is categorized by threat type, severity, and relevance score"
        },
        {
          "id": "AC-9",
          "given": "extracted threat indicators are available",
          "when": "analyst reviews the results",
          "then": "false positive rate is maintained below 10%"
        }
      ]
    },
    {
      "id": "US-4",
      "title": "Data Privacy and Governance Compliance",
      "asA": "Compliance Officer",
      "iWantTo": "ensure all threat intelligence processing complies with data privacy regulations and governance requirements",
      "soThat": "the bank maintains regulatory compliance across India and Singapore jurisdictions",
      "storyPoints": 5,
      "priority": "Critical",
      "tags": ["Compliance", "DataPrivacy", "Governance", "Regulatory"],
      "relatedUserStories": ["US-2", "US-6"],
      "epic": "Compliance and Security Framework",
      "acceptanceCriteria": [
        {
          "id": "AC-10",
          "given": "threat intelligence data is processed",
          "when": "compliance audit is conducted",
          "then": "all processing activities are logged and traceable for regulatory review"
        },
        {
          "id": "AC-11",
          "given": "personal or sensitive data is detected in threat intelligence",
          "when": "data privacy rules are applied",
          "then": "such data is anonymized or excluded from processing per regulatory requirements"
        },
        {
          "id": "AC-12",
          "given": "data retention policies are in effect",
          "when": "retention period expires",
          "then": "threat intelligence data is securely archived or disposed per governance requirements"
        }
      ]
    },
    {
      "id": "US-5",
      "title": "Centralized Threat Intelligence Repository",
      "asA": "Security Operations Center (SOC) Analyst",
      "iWantTo": "access a single source of processed and enriched threat intelligence",
      "soThat": "I can make informed security decisions based on comprehensive and up-to-date threat information",
      "storyPoints": 5,
      "priority": "High",
      "tags": ["Repository", "SingleSource", "ThreatIntelligence", "SOC"],
      "relatedUserStories": ["US-3", "US-7"],
      "epic": "Centralized Intelligence Platform",
      "acceptanceCriteria": [
        {
          "id": "AC-13",
          "given": "multiple threat intelligence sources are processed",
          "when": "SOC analyst queries the repository",
          "then": "consolidated and deduplicated threat intelligence is returned within 2 seconds"
        },
        {
          "id": "AC-14",
          "given": "threat intelligence is continuously updated",
          "when": "new threats are identified",
          "then": "repository is updated in near real-time with freshness indicators"
        },
        {
          "id": "AC-15",
          "given": "analyst searches for specific threat indicators",
          "when": "search query is submitted",
          "then": "relevant results are ranked by relevance, recency, and confidence score"
        }
      ]
    },
    {
      "id": "US-6",
      "title": "Multi-Jurisdiction Compliance Management",
      "asA": "Legal and Compliance Team",
      "iWantTo": "manage compliance requirements across India and Singapore jurisdictions",
      "soThat": "threat intelligence operations comply with local data protection and privacy laws",
      "storyPoints": 8,
      "priority": "High",
      "tags": ["MultiJurisdiction", "Compliance", "DataProtection", "Legal"],
      "relatedUserStories": ["US-4"],
      "epic": "Compliance and Security Framework",
      "acceptanceCriteria": [
        {
          "id": "AC-16",
          "given": "threat intelligence contains cross-border data",
          "when": "jurisdiction-specific rules are applied",
          "then": "data handling complies with both Indian and Singaporean data protection requirements"
        },
        {
          "id": "AC-17",
          "given": "regulatory requirements change in either jurisdiction",
          "when": "compliance rules are updated",
          "then": "system adapts to new requirements within 30 days of regulatory change"
        },
        {
          "id": "AC-18",
          "given": "compliance audit is requested",
          "when": "audit trail is generated",
          "then": "complete data lineage and processing history is available for both jurisdictions"
        }
      ]
    },
    {
      "id": "US-7",
      "title": "Web-Based Intelligence Dashboard",
      "asA": "Threat Intelligence Manager",
      "iWantTo": "monitor and visualize threat intelligence processing through a web-based dashboard",
      "soThat": "I can oversee operations, track performance metrics, and identify processing bottlenecks",
      "storyPoints": 5,
      "priority": "Medium",
      "tags": ["Frontend", "Dashboard", "Monitoring", "Visualization"],
      "relatedUserStories": ["US-5"],
      "epic": "User Interface and Reporting",
      "acceptanceCriteria": [
        {
          "id": "AC-19",
          "given": "dashboard is accessed via web browser",
          "when": "user loads the intelligence overview",
          "then": "real-time processing metrics and threat summaries are displayed within 3 seconds"
        },
        {
          "id": "AC-20",
          "given": "threat intelligence processing is ongoing",
          "when": "processing status is monitored",
          "then": "current processing queue, completion rates, and error statistics are visible"
        },
        {
          "id": "AC-21",
          "given": "historical trend analysis is requested",
          "when": "manager selects time range for analysis",
          "then": "threat volume trends and processing efficiency metrics are visualized"
        }
      ]
    }
  ],